483	2011	Modulating inhibitory control with direct current stimulation of the superior medial frontal cortex	Tzu-Yu Hsu, Lin-Yuan Tseng, Jia-Xin Yu, Wen-Jui Kuo, Daisy L Hung, Ovid J L Tzeng
483	2011	Modulating oscillatory brain activity correlates of behavioral inhibition using transcranial direct current stimulation.	Liron Jacobson, Adi Ezra, Uri Berger, Michal Lavidor
483	2011	Modulating the brain at work using noninvasive transcranial stimulation	R Andy McKinley, Nathaniel Bridges, Craig M Walters, Jeremy Nelson
484	2011	Modulation formats for 100G and beyond	Eugen Lach, Wilfried Idler
484	2011	Modulation of dendritic synaptic processing in the lateral superior olive by hyperpolarization-activated currents.	Katarina E Leão, Richardson N Leão, Bruce Walmsley
485	2011	Modulation of fear memory by retrieval and extinction: a clue for memory deconsolidation.	Ingie Hong, Jeongyeon Kim, Beomjong Song, Sungmo Park, Junuk Lee, Jihye Kim
486	2011	Modulation of microRNAs for potential cancer therapeutics.	Wei Wu
486	2011	Modulation of N400 in chronic non-fluent aphasia using low frequency Repetitive Transcranial Magnetic Stimulation (rTMS).	Caroline H S Barwood, Bruce E Murdoch, Brooke-Mai Whelan, David Lloyd, Stephan Riek, John D O'Sullivan
487	2011	Modulation of subgenual anterior cingulate cortex activity with real-time neurofeedback.	J Paul Hamilton, Gary H Glover, Jung-Jiin Hsu, Rebecca F Johnson, Ian H Gotlib
487	2011	Modulation of the motor system during visual and auditory language processing.	Ludovica Labruna, Miguel Fernández-del-Olmo, Ayelet Landau, Julie Duqué, Richard B Ivry
488	2012	Modulation of value representation by social context in the primate orbitofrontal cortex	João C B Azzi, Angela Sirigu, Jean-rené Duhamel
488	2011	Modulation of visually evoked cortical FMRI responses by phase of ongoing occipital alpha oscillations.	René Scheeringa, Ali Mazaheri, Ingo Bojak, David G Norris, Andreas Kleinschmidt
488	2012	Modulation transfer function of patch-based stereo systems	Ronny Klowsky
488	2011	Modulation-free optical locking of an external-cavity diode laser to a filter cavity.	Kazuhiro Hayasaka
490	2011	Molecular and functional heterogeneity of neural circuits: an example from the olfactory bulb.	Marco Sassoè-Pognetto
491	2011	Molecular aptamers for drug delivery.	Weihong Tan, Hui Wang, Yan Chen, Xiaobing Zhang, Haizhen Zhu, Chaoyong Yang
491	2012	Molecular Architecture and Assembly Principles of Vibrio cholerae Biofilms	V Berk, J C N Fong, G T Dempsey, O N Develioglu, X Zhuang, J Liphardt
491	2011	Molecular beacon-based bioimaging of multiple microRNAs during myogenesis.	Won Jun Kang, Ye Lim Cho, Ju Ri Chae, Jong Doo Lee, Kyung-Ju Choi, Soonhag Kim
491	2011	Molecular beam deposition of Al[sub 2]O[sub 3] on p-Ge(001)/Ge[sub 0.95]Sn[sub 0.05] heterostructure and impact of a Ge-cap interfacial layer	C Merckling, X Sun, Y Shimura, A Franquet, B Vincent, S Takeuchi
491	2012	Molecular beam epitaxial growth and characterization of catalyst-free InN/In(x)Ga(1-x)N core/shell nanowire heterostructures on Si(111) substrates.	Kai Cui, Saeed Fathololoumi, Md Golam Kibria, Gianluigi A Botton, Zetian Mi
492	2011	Molecular beam epitaxy grown GaNAsSb 1eV photovoltaic cell	K H Tan, S Wicaksono, W K Loke, D Li, S F Yoon, E A Fitzgerald
492	2011	Molecular characterization of organic electronic films.	Dean M DeLongchamp, R Joseph Kline, Daniel A Fischer, Lee J Richter, Michael F Toney
494	2011	Molecular cytogenetics and its contribution to the understanding of the chromosomal diversification in Hoplias malabaricus (Characiformes).	C A Vitorino, I L Souza, J N Rosa, G T Valente, C Martins, P C Venere
494	2011	Molecular decoding using luminescence from an entangled porous framework	Yohei Takashima, Virginia Martínez Martínez, Shuhei Furukawa, Mio Kondo, Satoru Shimomura, Hiromitsu Uehara
494	2012	Molecular Diagnosis of Infantile Mitochondrial Disease with Targeted Next-Generation Sequencing	Sarah E Calvo, Alison G Compton, Steven G Hershman, Sze Chern Lim, Daniel S Lieber, Elena J Tucker
497	2011	Molecular electronics based nanosensors on a viral scaffold.	Amy Szuchmacher Blum, Carissa M Soto, Kim E Sapsford, Charmaine D Wilson, Martin H Moore, Banahalli R Ratna
498	2012	Molecular evolution of vertebrate sex-determining genes.	Shuuji Mawaribuchi, Shin Yoshimoto, Shuntaro Ohashi, Nobuhiko Takamatsu, Michihiko Ito
498	2012	Molecular Fingerprints in the Electronic Properties of Crystalline Organic Semiconductors: From Experiment to Theory	S Ciuchi, R Hatch, H Höchst, C Faber, X Blase, S Fratini
498	2011	Molecular geometry optimization, two-photon absorption and electrochemistry of new diphenylethylene derivatives linking with benzophenone moiety through ether covalent bond.	Hongru Li, Fang Gao, Chunfeng Wang, Jianchao Wang, Shengtao Zhang
499	2012	Molecular Imaging and Contrast Agent Database ( MICAD )	Arvind Chopra, Liang Shan, W C Eckelman, Kam Leung, Martin Latterner, Stephen H Bryant
500	2011	Molecular mechanisms of working memory.	Zafar U Khan, E Chris Muly
501	2011	Molecular monolayers for conformal, nanoscale doping of InP nanopillar photovoltaics	Kee Cho, Daniel J Ruebusch, Min Hyung Lee, Jae Hyun Moon, Alexandra C Ford, Rehan Kapadia
502	2011	Molecular orientation affects localization accuracy in superresolution far-field fluorescence microscopy.	Johann Engelhardt, Jan Keller, Patrick Hoyer, Matthias Reuss, Thorsten Staudt, Stefan W Hell
502	2012	Molecular packing and solar cell performance in blends of polymers with a bisadduct fullerene.	Nichole Cates Miller, Sean Sweetnam, Eric T Hoke, Roman Gysel, Chad E Miller, Jonathan A Bartelt
502	2011	Molecular photoacoustic imaging of angiogenesis with integrin-targeted gold nanobeacons.	Dipanjan Pan, Manojit Pramanik, Angana Senpan, John S Allen, Huiying Zhang, Samuel A Wickline
503	2012	Molecular Rectifier Based on π-π Stacked Charge Transfer Complex	Yuta Tsuji, Aleksandar Tsekov Staykov, Kazunari Yoshizawa
504	2011	Molecular spintronics.	Masashi Shiraishi, Tadaaki Ikoma
505	2011	Molecular targets of phytochemicals for cancer prevention.	Ki Won Lee, Ann M Bode, Zigang Dong
505	2011	Molecular Tunnel Junctions Based on π-Conjugated Oligoacene Thiols and Dithiols between Ag, Au, and Pt Contacts: Effect of Surface Linking Group and Metal Work Function.	Bongsoo Kim, Seong Ho Choi, X-Y Zhu, C Daniel Frisbie
505	2011	Molecular typing of Mycobacterium tuberculosis circulated in Moscow, Russian Federation.	M V Afanas'ev, L N Ikryannikova, E N Il'ina, A V Kuz'min, E E Larionova, T G Smirnova
505	2011	Molecular X-ray computed tomography of myelin in a rat brain.	T H Jensen, M Bech, O Bunk, A Menzel, A Bouchet, G Le Duc
506	2011	Molecular-Scale and Nanoscale Morphology of P3HT:PCBM Bulk Heterojunctions: Energy-Filtered TEM and Low-Dose HREM	Lawrence F Drummy, Robert J Davis, Diana L Moore, Michael Durstock, Richard A Vaia, Julia W P Hsu
507	2011	Moment closure approximations for stochastic kinetic models with rational rate laws.	Peter Milner, Colin S Gillespie, Darren J Wilkinson
511	2011	Monitoring changes of 3D building elements from unordered photo collections	Mani Golparvar-Fard, Feniosky Pena-Mora, Silvio Savarese
511	2011	Monitoring Code Quality and Development Activity by Software Maps	Johannes Bohnet, Jürgen Döllner
513	2011	Monitoring of drug and stimulation induced cerebral blood flow velocity changes in rat sensory cortex using spectral domain Doppler optical coherence tomography.	Chuan Wang, Yong Yang, Zhihua Ding, Jie Meng, Kai Wang, Wenwei Yang
514	2011	Monitoring of optical signal-to-noise ratio using statistical moments of adaptive-equalizer output in coherent optical receivers	Md Saifuddin Faruk, Kazuro Kikuchi
514	2011	Monitoring of Posture Allocations and Activities by a Shoe-Based Wearable Sensor	Edward S Sazonov, George Fulk, James Hill, Yves Schutz, Raymond Browning
514	2012	Monitoring of seizures in the newborn	DK Shah, GB Boylan, JM Rennie
515	2011	Monitoring Temperate Glacier Displacement by Multi-Temporal TerraSAR-X Images and Continuous GPS Measurements	Renaud Fallourd, Olivier Harant, Emmanuel Trouve, Jean-Marie Nicolas, Michel Gay, Andrea Walpersdorf
516	2011	Monitoring the growth and drug susceptibility of individual bacteria using asynchronous magnetic bead rotation sensors.	Paivo Kinnunen, Irene Sinn, Brandon H McNaughton, Duane W Newton, Mark A Burns, Raoul Kopelman
516	2011	Monitoring voltage stability with real-time dynamics monitoring system (RTDMS)	Abhijeet Agarwal, John Balance, Bharat Bhargava, Jim Dyer, Song Xue
516	2011	Monkeys (Macaca Mulatta and Cebus Apella) and Human Adults and Children (Homo Sapiens) Compare Subsets of Moving Stimuli Based on Numerosity	Michael J Beran, Scott Decker, Allison Schwartz, Natasha Schultz
517	2012	Monocular 3D Reconstruction of Locally Textured Surfaces	Aydin Varol, Appu Shaji, Mathieu Salzmann, Pascal Fua
517	2011	Monocular based lane-change on scaled-down autonomous vehicles	Wen He, Xiaodong Wang, Guisheng Chen, Mu Guo, Tianlei Zhang, Peng Han
517	2011	Monocular model-based 3D vehicle tracking for autonomous vehicles in unstructured environment	Michael Manz, Thorsten Luettel, Felix Von Hundelshausen, Hans-Joachim Wuensche
518	2011	Monocular visual odometry for robot localization in LNG pipes	Peter Hansen, Hatem Alismail, Peter Rander, Brett Browning
518	2011	Monocular-SLAM–based navigation for autonomous micro helicopters in GPS-denied environments	Stephan Weiss, Davide Scaramuzza, Roland Siegwart
518	2011	Monodisperse (In, Ga)N insertions in catalyst-free-grown GaN(0001) nanowires.	M Knelangen, M Hanke, E Luna, L Schrottke, O Brandt, A Trampert
518	2012	Monodisperse gas-filled microparticles from reactions in double emulsions.	Wynter J Duncanson, Alireza Abbaspourrad, Ho Cheung Shum, Shin-Hyun Kim, Laura L A Adams, David A Weitz
518	2011	Monodisperse porous LiFePO4 microspheres for a high power Li-ion battery cathode.	Chunwen Sun, Shreyas Rajasekhara, John B Goodenough, Feng Zhou
518	2011	Monodispersed magnetite nanoparticles optimized for magnetic fluid hyperthermia: Implications in biological systems.	Amit P Khandhar, R Matthew Ferguson, Kannan M Krishnan
519	2011	Monolithic 100 Gb/s twin-IQ Mach-Zehnder modulators for advanced hybrid high-capacity transmitter boards	T Brast, R Kaiser, K O Velthaus, M Gruner, B Maul, M Hamacher
520	2011	Monolithic dual wavelength DFB lasers for narrow linewidth heterodyne beat-note generation	Frederic Van Dijk, Alain Accard, Alain Enard, Olivier Drisse, Dalila Make, Francois Lelarge
520	2011	Monolithic InP Multiwavelength Coherent Receiver Using a Chirped Arrayed Waveguide Grating	Christopher R Doerr, Liming Zhang, Peter J Winzer
520	2012	Monolithic integration of a nanomechanical resonator to an optical microdisk cavity	Onur Basarir, Suraj Bramhavar, Kamil L Ekinci
520	2011	Monolithic integration of continuously tunable plasmonic nanostructures.	Nathan C Lindquist, Timothy W Johnson, David J Norris, Sang-Hyun Oh
521	2011	Monolithic Integration of Silicon- , Germanium- , Telecommunications Applications	Tai Tsuchizawa, Koji Yamada, Toshifumi Watanabe, Sungbong Park, Hidetaka Nishi, Rai Kou
521	2011	Monolithic polarization-diverse receivers	C R Doerr
521	2011	Monolithic silicon chip with 10 modulator channels at 25 Gbps and 100-GHz spacing	Long Chen, Christopher R Doerr, Po Dong, Young-kai Chen
521	2011	Monolithic single GaN nanowire laser with photonic crystal microcavity on silicon	Junseok Heo, Wei Guo, Pallab Bhattacharya
521	2011	Monolithically integrated dual-quadrature coherent receiver on InP with 30 nm tunable SG-DBR local oscillator	Kimchau N Nguyen, John M Garcia, Erica Lively, Henrik N Poulsen, Douglas M Baney, Daniel J Blumenthal
522	2012	Monolithically Integrated VOA-MUX with Power Monitors based on Submicron Silicon Photonics Platform	Po Dong, Long Chen, Young-kai Chen
522	2012	Monotonicity and Error Type Differentiability in Performance Measures for Target Detection and Tracking in Video	Ido Leichter, Eyal Krupka
525	2011	Monte Carlo Pose Estimation with Quaternion Kernels and the Bingham Distribution	Jared Glover
525	2011	Monte Carlo randomization tests for large-scale abundance datasets on the GPU.	John L Van Hemert, Julie A Dickerson
526	2011	Monte Carlo simulation of temperature-dependent elastic properties of graphene	Shuo Chen, D C Chrzan
526	2011	Monte Carlo simulation of the spatial resolution and depth sensitivity of two-dimensional optical imaging of the brain.	Peifang Tian, Anna Devor, Sava Sakadzić, Anders M Dale, David A Boas
526	2011	Monte Carlo simulations of high-pressure phase equilibria of CO2-H2O mixtures.	Lynn B Munday, Peter W Chung, Betsy M Rice, Santiago D Solares
526	2011	Monte Carlo simulations of mobility in doped GaAs using self-consistent Fermi–Dirac statistics	A Islam, K Kalna
527	2011	Monte Carlo value iteration for continuous-state POMDPs	Haoyu Bai, David Hsu, Wee Sun Lee, Vien A Ngo
527	2011	Monte-Carlo stability analysis of microwave amplifiers	J M Collantes, N Otegi, A Anakabe, N Ayllon, A Mallet, G Soubercaze-Pun
527	2011	MoO3/TiO2 core/shell nanorods: Controlled-synthesis and low-temperature gas sensing properties	Yu-Jin Chen, Gang Xiao, Tie-Shi Wang, Fan Zhang, Yang Ma, Peng Gao
528	2011	MoodMixer : EEG-based Collaborative Sonification	Grace Leslie, Tim Mullen
528	2012	Moral values are associated with individual differences in regional brain volume.	GJ Lewis, R Kanai, TC Bates, G Rees
529	2011	More accurate estimation of diffusion tensor parameters using diffusion Kurtosis imaging.	Jelle Veraart, Dirk H J Poot, Wim Van Hecke, Ines Blockx, Annemie Van Der Linden, Marleen Verhoye
529	2011	More accurate pinhole camera calibration with imperfect planar target	Klaus H Strobl, Gerd Hirzinger
529	2011	More effective nanomedicines through particle design.	Jin Wang, James D Byrne, Mary E Napier, Joseph M DeSimone
529	2011	More is less: signal processing and the data deluge.	Richard G Baraniuk
530	2011	Morphogenetic Robotics: An Emerging New Field in Developmental Robotics	Yaochu Jin, Yan Meng
531	2011	Morphological change in machines accelerates the evolution of robust behavior	Josh Bongard
531	2011	Morphological change tracking of dendritic spines based on structural features.	J Son, S Song, S Lee, S Chang, M Kim
532	2011	Morphological modification of nanostructured ultrathin-layer chromatography stationary phases.	S R Jim, A J Oko, M T Taschuk, M J Brett
532	2011	Morphological road segmentation in urban areas from high resolution satellite images	R Gaetano, J Zerubia, G Scarpa, G Poggi
532	2011	Morphological subtypes of ovarian carcinoma: a review with emphasis on new developments and pathogenesis.	W Glenn McCluggage
533	2011	Morphology and molecular orientation of thin-film bis(triisopropylsilylethynyl) pentacene	Jihua Chen, David C Martin, John E Anthony
534	2012	Morphology characterization in organic and hybrid solar cells	Wei Chen, Maxim P Nikiforov, Seth B Darling
534	2012	Morphology control of cadmium selenide nanocrystals: insights into the roles of di-n-octylphosphine oxide (DOPO) and ucid (DOPA).	Fudong Wang, William E Buhro
534	2011	Morphology dependent dye-sensitized solar cell properties of nanocrystalline zinc oxide thin films	S K Sharma, A I Inamdar, Hyunsik Im, B G Kim, P S Patil
534	2011	Morphology Development in Relation to the Ternary Phase Diagram of Biodegradable PDLLA/PCL/PEO Blends	Sasiwimon Buddhiranon, Namil Kim, Thein Kyu
534	2011	Morphology of all-solution-processed "bilayer" organic solar cells.	Kwan H Lee, Paul E Schwenn, Arthur R G Smith, Hamish Cavaye, Paul E Shaw, Michael James
535	2011	Morphology of self-catalyzed GaN nanowires and chronology of their formation by molecular beam epitaxy.	E Galopin, L Largeau, G Patriarche, L Travers, F Glas, J C Harmand
536	2012	MoS 2 Dual-Gate MOSFET with Atomic-Layer-Deposited Al 2 O 3 as Top-Gate Dielectric	Mos Dual-gate Mosfet, Atomic-layer-deposited Al O Top-gate Dielectric
536	2011	MOS gas sensors: What determines our choice?	Gotan H Jain
537	2011	Mosaic analysis with double markers reveals tumor cell of origin in glioma.	Chong Liu, Jonathan C Sage, Michael R Miller, Roel G W Verhaak, Simon Hippenmeyer, Hannes Vogel
537	2011	Mosaik: A framework for modular simulation of active components in Smart Grids	Steffen Schutte, Stefan Scherfke, Martin Troschel
538	2012	Most Networks in Wagner's Model Are Cycling	Ricardo Pinho, Elhanan Borenstein, Marcus W Feldman
538	2012	Most people do not ignore salient invalid cues in memory-based decisions.	Christine Platzer, Arndt Bröder
542	2012	Motion correction and registration of high b-value diffusion weighted images	Shani Ben-Amitay, Derek K Jones, Yaniv Assaf
542	2011	Motion correction for phase-resolved dynamic optical coherence tomography imaging of rodent cerebral cortex	Jonghwan Lee, Vivek Srinivasan, Harsha Radhakrishnan, David A Boas
543	2011	Motion fault detection and isolation in Body Sensor Networks	Duk-Jin Kim, B Prabhakaran
543	2011	Motion learning and adaptive impedance for robot control during physical interaction with humans	Elena Gribovskaya, Abderrahmane Kheddar, Aude Billard
544	2011	Motion planning and coordination for robot systems based on representation space.	Jianbo Su, Wenlong Xie
545	2011	Motion planning for concentric tube robots using mechanics-based models	Luis G Torres, Ron Alterovitz
546	2011	Motion planning of extreme locomotion maneuvers using multi-contact dynamics and numerical integration	Luis Sentis, Mike Slovich
546	2011	Motion reconstruction using sparse accelerometer data	Jochen Tautges, Arno Zinke, Björn Krüger, Jan Baumann, Andreas Weber, Thomas Helten
547	2011	Motion silences awareness of visual change.	Jordan W Suchow, George A Alvarez
547	2012	Motion tracking for medical imaging: a nonvisible structured light tracking approach.	Oline Vinter Olesen, Rasmus R Paulsen, Liselotte Højgaard, Bjarne Roed, Rasmus Larsen
548	2011	Motion vector coding techniques for HEVC	Jian-Liang Lin, Yi-Wen Chen, Yu-Pao Tsai, Yu-Wen Huang, Shawmin Lei
548	2011	Motion-analysis studies of transtibial prosthesis users: a systematic review.	David Rusaw, Nerrolyn Ramstrand
548	2011	Motion-robust MRI through real-time motion tracking and retrospective super-resolution volume reconstruction	Ali Gholipour, Martin Polak, Andre Van Der Kouwe, Erez Nevo, Simon K Warfield
549	2011	Motivate: Towards context-aware recommendation mobile system for healthy living	Yuzhong Lin, Joran Jessurun, Bauke De Vries, Harry Timmermans
549	2011	Motivated attention to cocaine and emotional cues in abstinent and current cocaine users--an ERP study.	Jonathan P Dunning, Muhammad A Parvaz, Greg Hajcak, Thomas Maloney, Nelly Alia-Klein, Patricia A Woicik
550	2011	Motor and attentional mechanisms involved in social interaction-Evidence from mu and alpha EEG suppression.	Anat Perry, Libi Stein, Shlomo Bentin
551	2011	Motor control: a sense of movement.	Leonie Welberg
551	2011	Motor coordination: when two have to act as one	Daniel A Braun, Pedro A Ortega, Daniel M Wolpert
552	2011	Motor cortical prediction of EMG: evidence that a kinetic brain-machine interface may be robust across altered movement dynamics.	A Cherian, M O Krucoff, L E Miller
553	2011	Motor learning with augmented feedback: modality-dependent behavioral and neural consequences.	Renaud Ronsse, Veerle Puttemans, James P Coxon, Daniel J Goble, Johan Wagemans, Nicole Wenderoth
554	2011	Motor preparation in unilateral cerebral palsy.	A Hadjipanayis, C Hadjichristodoulou, S Youroukos
555	2011	Motor system hyperconnectivity in juvenile myoclonic epilepsy: a cognitive functional magnetic resonance imaging study	Christian Vollmar, Jonathan O'Muircheartaigh, Gareth J Barker, Mark R Symms, Pamela Thompson, Veena Kumari
555	2011	Motor unit recruitment during neuromuscular electrical stimulation: a critical appraisal.	C Scott Bickel, Chris M Gregory, Jesse C Dean
555	2011	Motor-sensory convergence in object localization: a comparative study in rats and humans.	Guy Horev, Avraham Saig, Per Magne Knutsen, Maciej Pietr, Chunxiu Yu, Ehud Ahissar
555	2011	Motoring ahead with rodents.	Bence P Olveczky
556	2011	Moulding the flow of surface plasmons using conformal and quasiconformal mapping	Paloma A Huidobro, Maxim L Nesterov, Luis Martin-Moreno, Francisco J Garcia-Vidal
557	2011	Movement segmentation using a primitive library	Franziska Meier, Evangelos Theodorou, Freek Stulp, Stefan Schaal
558	2011	Movement variability during single leg jump landings in individuals with and without chronic ankle instability.	Cathleen Brown, Bradley Bowser, Kathy J Simpson
560	2011	Moving to the centre”: A gaze-driven remote camera control for teleoperation	Dingyun Zhu, Tom Gedeon, Ken Taylor
560	2011	MOVPE IIIV material growth on silicon substrates and its comparison to MBE for future high performance and low power logic applications	N Mukherjee, J Boardman, B Chu-Kung, G Dewey, A Eisenbach, J Fastenau
561	2011	MPEG-hexPLA micelles as novel carriers for hypericin, a fluorescent marker for use in cancer diagnostics.	Karine Mondon, Magali Zeisser-Labouèbe, Robert Gurny, Michael Möller
563	2011	MR image reconstruction from highly undersampled k-space data by dictionary learning.	Saiprasad Ravishankar, Yoram Bresler
563	2012	MR imaging near metal with undersampled 3D radial UTE-MAVRIC sequences.	Michael Carl, Kevin Koch, Jiang Du
563	2011	MR in OR: First analysis of AR/VR visualization in 100 intra-operative Freehand SPECT acquisitions	Asli Okur, Seyed-Ahmad Ahmadi, Ali Bigdelou, Thomas Wendler, Nassir Navab
565	2011	MRF energy minimization and beyond via dual decomposition.	Nikos Komodakis, Nikos Paragios, Georgios Tziritas
565	2011	MRI After Arthroplasty: Comparison of MAVRIC and Conventional Fast Spin-Echo Techniques.	Catherine L Hayter, Matthew F Koff, Parina Shah, Kevin M Koch, Theodore T Miller, Hollis G Potter
565	2011	MRI artifacts in human brain tissue after prolonged formalin storage.	Sara Van Duijn, Rob J A Nabuurs, Sanneke Van Rooden, Marion L C Maat-Schieman, Sjoerd G Van Duinen, Mark A Van Buchem
565	2011	MRI atlas of the human hypothalamus.	Marc Baroncini, Patrice Jissendi, Eglantine Balland, Pierre Besson, Jean-Pierre Pruvo, Jean-Paul Francke
566	2011	MRI of perfusion-diffusion mismatch in non-human primate (baboon) stroke: a preliminary report.	Hsiao-Ying Wey, Ghazwan M Kroma, Jinqi Li, M Michelle Leland, Lisa Jones, Timothy Q Duong
567	2011	MRI reconstruction from 2D truncated k-space.	Jianhua Luo, Yuemin Zhu, Wanqing Li, Pierre Croisille, Isabelle E Magnin
567	2011	MRI Shows a Region-Specific Pattern of Atrophy in Spinocerebellar Ataxia Type 2.	Brian C Jung, Soo I Choi, Annie X Du, Jennifer L Cuzzocreo, Howard S Ying, Bennett A Landman
567	2011	MRI-assisted PET motion correction for neurologic studies in an integrated MR-PET scanner.	Ciprian Catana, Thomas Benner, Andre Van Der Kouwe, Larry Byars, Michael Hamm, Daniel B Chonde
567	2011	MRI-based age prediction using hidden Markov models.	Bing Wang, Tuan D Pham
568	2011	MRI-guided tumor tracking in lung cancer radiotherapy.	Laura I Cerviño, Jiang Du, Steve B Jiang
568	2011	MRI-related heating near deep brain stimulation electrodes: more data are needed.	Akshay A Gupte, Devashish Shrivastava, Maggie A Spaniol, Aviva Abosch
569	2011	MSA compatible package size, dual-channel Fast Automatic Level controlled SOA subsystems for optical packet and PON signals	Yutaka Kai, Setsuo Yoshida, Kyosuke Sone, Goji Nakagawa, Susumu Kinoshita
569	2011	MSCTP-Based Handover Scheme for Vehicular Networks	YeNa Kim, SuKyoung Lee
569	2011	MT-Scribe: an end-user approach to automate software model evolution	Yu Sun, Jeff Gray, Jules White
569	2011	MTCF : A framework for designing and coding musical tabletop applications directly in Pure Data	Carles F Julià, Daniel Gallardo, Sergi Jordà
570	2011	Much ado about nothing: Nowak et al.'s charge against inclusive fitness theory.	F Rousset, S Lion
571	2012	Multi high-order anisotropic self-diffraction in Cerium doped BaTiO	S Plaipichit, P Buranasiri, R Nuansri, W Neeyakorn
571	2012	Multi Kernel Learning with Online-Batch Optimization	Francesco Orabona
571	2011	Multi Modality State-of-the-Art Medical Image Segmentation and Registration Methodologies	Fahmi Khalifa, Garth M Beache, Georgy Gimel, Jasjit S Suri, Ayman S El-baz
572	2011	Multi-agent Architecture for Heterogeneous Reasoning under Uncertainty Combining MSBN and Ontologies in Distributed Network Diagnosis	Alvaro Carrera, Carlos A Iglesias
572	2011	Multi-agent event recognition in structured scenarios	Vlad I Morariu, Larry S Davis
572	2011	Multi-agent framework for spatial load forecasting	J D Melo, E M Carreno, A Padilha-Feltrin
573	2011	Multi-agent Smart Grid Automation Architecture based on IEC 61850/61499 Intelligent Logical Nodes	G Zhabelova, V Vyatkin
573	2011	Multi-agent system for energy resource scheduling of integrated microgrids in a distributed system	T Logenthiran, Dipti Srinivasan, Ashwin M Khambadkone
574	2011	Multi-Agent systems hardware development and deployment for smart grid control applications	R Belkacemi, A Feliachi, M A Choudhry, J E Saymansky
575	2012	Multi-band slow light metamaterial	Lei Zhu, Fan-Yi Meng, Jia-Hui Fu, Qun Wu, Jun Hua
576	2011	Multi-Beam Multi-Layer Leaky-Wave SIW Pillbox Antenna for Millimeter-Wave Applications	Mauro Ettorre, Ronan Sauleau, Laurent Le Coq
576	2011	Multi-camera multi-object tracking by robust hough-based homography projections	Sabine Sternig, Thomas Mauthner, Arnold Irschara, Peter M Roth, Horst Bischof
577	2012	Multi-Carrier Approaches for Next-Generation Transmission : Why , Where and How ? Acknowledgment Spectrally efficient transmission	Sander L Jansen Sanderjansennsncom, Dirk Van Den Borne, Maxim Kuschnerov, Antonio Napoli, Alberto Bononi, Universita Parma
577	2011	Multi-Carrier Burst Contention (MCBC): Scalable Medium Access Control for Wireless Networks	B Roman, F Stajano, I Wassell, D Cottingham
